"";"titulo";"fecha";"cuerpo";"enlace"
"18";"TC no acoge a trámite requerimiento de diputados oficialistas contra ley de permisología del gobierno";2025-07-22;"En una sesión ordinaria de Pleno, el Tribunal Constitucional decidió no acoger a trámite un requerimiento de inconstitucionalidad presentado por diputadas y diputados oficialistas dirigido contra artículos específicos de la Ley de Permisos Sectoriales, también conocida como permisología.

La resolución fue adoptada con el voto de los ministros María Pía Silva Gallinato, Miguel Ángel Fernández, Héctor Mery Romero y Marcela Peredo Rojas.

Por su parte, la presidenta de la instancia, la ministra Daniela Marzi Muñoz y sus pares Nacy Yáñez Fuenzalida, Catalina Lagos Tschorne y Alejandra Precht Rorris estuvieron por admitir el requerimiento. Algo que finalmente no ocurrió.

Lee también...
¿Por qué parlamentarios oficialistas buscan impugnar en el TC artículos de proyecto clave de Gobierno? Martes 08 Julio, 2025 | 19:55

El ministro de Economía, Nicolás Grau, calificó la decisión como “una buena noticia para el país”. Esto, pues, “es un proyecto muy importante porque nos va a permitir reducir los tiempos de evaluación sectorial entre un 30% y un 70%”.

Lo anterior, aseguró, “sin afectar el estándar regulatorio ni mucho menos el estándar ambiental que no es tocado por este proyecto (…) daremos una opinión más detallada cuando sepamos los argumentos y el raciocinio que aplicó el Tribunal Constitucional para efectos de esta decisión”.

Recordemos que se trató de un grupo de más de 40 parlamentarios que argumentaban que los artículos impugnados (artículo 7, letra a; 8, 10, 76 y 104) “transgreden garantías constitucionales como el derecho a la salud y al de vivir en un medio ambiente libre de contaminación”.

El documento ingresado al TC identificaba cinco enmiendas específicas dentro de la ley como cuestionables. La impugnación se basa en que estas disposiciones contravendrían garantías constitucionales y tratados internacionales ratificados por Chile, mencionando expresamente el Convenio 169 sobre Consulta Indígena.

⚖️ En sesión ordinaria de Pleno, el Tribunal Constitucional decidió hoy no acoger a tramitación el requerimiento de inconstitucionalidad Rol N• 16.625-25 CPT, de un grupo de H. Diputadas y Diputados, por el proyecto de ley que establece una Ley Marco de Autorizaciones… pic.twitter.com/1qPoQRQY7U

— Tribunal Constitucional de Chile (@tribconst_chile) July 22, 2025

El proyecto de permisología del gobierno

Según información entregada por el mismo gobierno, la normativa busca “reducir sustantivamente los tiempos de tramitación de permisos para proyectos de inversión, sin disminuir los estándares regulatorios”.

En ese sentido, se califica dicha ley como “la más importante en la materia en las últimas dos décadas, moderniza más de 380 permisos que hoy dependen de 37 servicios públicos”.

Permisos Sectoriales: son aquellos permisos no ambientales, necesarios para concretar un proyecto de inversión. Existen más de 380 permisos sectoriales, tramitados por más de 37 servicios del Estado.

Igualmente, con dicha ley se “busca optimizar y reducir entre un 30% y un 70% los tiempos de tramitación de permisos sectoriales, simplificando y modernizando los procesos administrativos”.

Por último, se busca contribuir con el aumento del crecimiento económico, gracias a la activación de proyectos que hoy están detenidos.
";"https://www.biobiochile.cl/noticias/nacional/chile/2025/07/22/tc-no-acoge-a-tramite-requerimiento-de-diputados-oficialistas-contra-ley-de-permisologia-del-gobierno.shtml"
"19";"CNE niega que cargo en cuenta de luz se destine a pagar compensaciones y asegura que evitó alza de 37%";2025-07-22;"Después que Ciper revelara que —desde junio de 2024— las cuentas de luz incluyen un cobro para que los usuarios financien las compensaciones que reciben tras cortes de electricidad; desde la Comisión Nacional de Energía (CNE) negaron dicha situación, precisando el cobro al que alude el medio.

Recordemos que el reportaje indicaba que 21 de las 26 empresas distribuidoras del país aplican dos cargos que suman el 0.52% del valor total de la boleta, los que irían destinados a costear futuras compensaciones.

Lee también...
Clientes financian sus propias compensaciones por cortes de luz: revelan cobro encubierto en boletas Martes 22 Julio, 2025 | 00:03

Esto fue ahora desmentido por la CNE, que mediante un comunicado sostuvo: “Las tarifas eléctricas no incluyen ningún cargo destinado a financiar compensaciones que las empresas distribuidoras deben pagar a los consumidores por incumplimientos en la calidad de servicio. Tampoco existe un fondo destinado a financiar compensaciones futuras que las empresas deben pagar a los consumidores”.

“La información entregada a Ciper corresponde a la estimación de un parámetro técnico utilizado en el diseño de la empresa modelo teórica que sirve de base para determinar las tarifas de distribución. Es incorrecto interpretar que algún criterio técnico utilizado para definir costos eficientes de la empresa modelo tenga vinculación directa con los costos reales de las distribuidoras o con las compensaciones efectivamente pagadas a los usuarios“, aseguran.

CNE asegura que evitó alza en cuentas de luz

Tras ello, la CNE explica que “la metodología para definir las tarifas de distribución fue ampliamente discutida con las empresas distribuidoras en el proceso tarifario 2020-2024 e incluso fue objeto de múltiples discrepancias que fueron resueltas por el Panel de Expertos”.

Lee también...
Cuándo salen los resultados de última postulación al Subsidio Eléctrico ¿Se paga en una cuota o más? Lunes 21 Julio, 2025 | 19:45

En ese sentido, dicen que “la solución técnica adoptada por la Comisión Nacional de Energía (CNE), y ratificada en Panel de Expertos, permitió evitar un alza muy significativa de las tarifas eléctricas promovida por algunas empresas“. Asegurando que “de haber acogido la alternativa planteada por estas empresas, los clientes podrían haber sufrido un alza real de hasta un 37% adicional en sus tarifas de distribución, cifra que, al considerar la inflación acumulada desde 2020, podría haber llegado a cerca de un 80%”.

“En resumen, el criterio técnico adoptado por la CNE evitó que los clientes o consumidores pagaran sobrerentas por aproximadamente US$1.000 millones adicionales a las empresas eléctricas, montos que habrían debido sumarse a las reliquidaciones pendientes por inflación acumulada“, concluyen.
";"https://www.biobiochile.cl/noticias/economia/negocios-y-empresas/2025/07/22/cne-niega-que-cargo-en-cuenta-de-luz-se-destine-a-pagar-compensaciones-y-asegura-que-evito-alza-de-37.shtml"
